{
  "schema_version": "1.0",
  "operation_id": "op-cut-001",
  "project_id": "project-demo-001",
  "revision_id": "rev-001",
  "operation_type": "ripple_delete",
  "origin": "magic_wand",
  "status": "applied",
  "created_at": "2026-09-04T12:20:00Z",
  "range": {
    "start_us": 4200000,
    "end_us": 6100000
  },
  "reason": "Remove a high-confidence silent gap.",
  "confidence": 0.99,
  "evidence_ids": [
    "silence-001"
  ],
  "before": {
    "kept": true
  },
  "after": {
    "kept": false
  },
  "undo": {
    "restore_range": {
      "start_us": 4200000,
      "end_us": 6100000
    }
  },
  "transaction_id": "tx-magic-001"
}
